{"external_claims":0,"fully_verified_dossiers":0,"identity_claims":0,"independent_review":{"corrected_transcriptions":2,"crops_reviewed":2,"decision_seal_sha256":"fb3892870778ac9a683cada3187190fdd643992987436a2b7623a2b2cf4e3ff6","decisions_sha256":"32d85f7815a2ef583e36e988ed330347198db056de04f3fa60bd4e42414c536f","input_sha256":"c263eef97d3cd1662954a50748b3f9fadab5cf65ff79ac33ba80b909969699b3","raw_ocr_comparison":{"reason":"No original-frame machine OCR proposals intersect either reviewed crop.","value":null},"review_session_id":"independent-session-20260713-ground-v1","reviewer_id":"independent-reviewer-pixel-ocr-v1","scenes_reviewed":6},"ocr_decisions":"two_corrected_visual_transcriptions","originals":6,"pixel_decisions":"sealed_external_independent_review","schema_version":"ground_originals_v1.0.0","tasks":0}
